[
  {
    "sqlKey": "com.test.mapper.OrderMapper.findOrdersConditional",
    "risks": [
      {
        "riskType": "select_star",
        "severity": "LOW",
        "message": "Avoid SELECT *. Specify only needed columns to reduce data transfer and prevent issues with schema changes.",
        "location": "line 1, column 0",
        "branchIds": []
      }
    ],
    "prunedBranches": [],
    "recommendedForBaseline": true
  },
  {
    "sqlKey": "com.test.mapper.OrderMapper.findOrdersByMode",
    "risks": [
      {
        "riskType": "select_star",
        "severity": "LOW",
        "message": "Avoid SELECT *. Specify only needed columns to reduce data transfer and prevent issues with schema changes.",
        "location": "line 1, column 0",
        "branchIds": []
      }
    ],
    "prunedBranches": [],
    "recommendedForBaseline": true
  },
  {
    "sqlKey": "com.test.mapper.OrderMapper.findOrdersComplex",
    "risks": [
      {
        "riskType": "select_star",
        "severity": "LOW",
        "message": "Avoid SELECT *. Specify only needed columns to reduce data transfer and prevent issues with schema changes.",
        "location": "line 1, column 0",
        "branchIds": []
      }
    ],
    "prunedBranches": [],
    "recommendedForBaseline": true
  },
  {
    "sqlKey": "com.test.mapper.UserMapper.testSingleIf",
    "risks": [
      {
        "riskType": "select_star",
        "severity": "LOW",
        "message": "Avoid SELECT *. Specify only needed columns to reduce data transfer and prevent issues with schema changes.",
        "location": "line 1, column 0",
        "branchIds": []
      }
    ],
    "prunedBranches": [],
    "recommendedForBaseline": true
  },
  {
    "sqlKey": "com.test.mapper.UserMapper.testTwoIf",
    "risks": [
      {
        "riskType": "select_star",
        "severity": "LOW",
        "message": "Avoid SELECT *. Specify only needed columns to reduce data transfer and prevent issues with schema changes.",
        "location": "line 1, column 0",
        "branchIds": []
      }
    ],
    "prunedBranches": [],
    "recommendedForBaseline": true
  },
  {
    "sqlKey": "com.test.mapper.UserMapper.testThreeIf",
    "risks": [
      {
        "riskType": "select_star",
        "severity": "LOW",
        "message": "Avoid SELECT *. Specify only needed columns to reduce data transfer and prevent issues with schema changes.",
        "location": "line 1, column 0",
        "branchIds": []
      }
    ],
    "prunedBranches": [],
    "recommendedForBaseline": true
  },
  {
    "sqlKey": "com.test.mapper.UserMapper.testFourIf",
    "risks": [
      {
        "riskType": "select_star",
        "severity": "LOW",
        "message": "Avoid SELECT *. Specify only needed columns to reduce data transfer and prevent issues with schema changes.",
        "location": "line 1, column 0",
        "branchIds": []
      }
    ],
    "prunedBranches": [],
    "recommendedForBaseline": true
  },
  {
    "sqlKey": "com.test.mapper.UserMapper.testChooseWhen",
    "risks": [
      {
        "riskType": "select_star",
        "severity": "LOW",
        "message": "Avoid SELECT *. Specify only needed columns to reduce data transfer and prevent issues with schema changes.",
        "location": "line 1, column 0",
        "branchIds": []
      }
    ],
    "prunedBranches": [],
    "recommendedForBaseline": true
  },
  {
    "sqlKey": "com.test.mapper.UserMapper.testChooseOtherwise",
    "risks": [
      {
        "riskType": "select_star",
        "severity": "LOW",
        "message": "Avoid SELECT *. Specify only needed columns to reduce data transfer and prevent issues with schema changes.",
        "location": "line 1, column 0",
        "branchIds": []
      }
    ],
    "prunedBranches": [],
    "recommendedForBaseline": true
  },
  {
    "sqlKey": "com.test.mapper.UserMapper.testWhereIf",
    "risks": [
      {
        "riskType": "select_star",
        "severity": "LOW",
        "message": "Avoid SELECT *. Specify only needed columns to reduce data transfer and prevent issues with schema changes.",
        "location": "line 1, column 0",
        "branchIds": []
      }
    ],
    "prunedBranches": [],
    "recommendedForBaseline": true
  },
  {
    "sqlKey": "com.test.mapper.UserMapper.testForeachIn",
    "risks": [
      {
        "riskType": "select_star",
        "severity": "LOW",
        "message": "Avoid SELECT *. Specify only needed columns to reduce data transfer and prevent issues with schema changes.",
        "location": "line 1, column 0",
        "branchIds": []
      }
    ],
    "prunedBranches": [],
    "recommendedForBaseline": true
  },
  {
    "sqlKey": "com.test.mapper.UserMapper.testTrim",
    "risks": [
      {
        "riskType": "select_star",
        "severity": "LOW",
        "message": "Avoid SELECT *. Specify only needed columns to reduce data transfer and prevent issues with schema changes.",
        "location": "line 1, column 0",
        "branchIds": []
      }
    ],
    "prunedBranches": [],
    "recommendedForBaseline": true
  },
  {
    "sqlKey": "com.test.mapper.UserMapper.testIfChoose",
    "risks": [
      {
        "riskType": "select_star",
        "severity": "LOW",
        "message": "Avoid SELECT *. Specify only needed columns to reduce data transfer and prevent issues with schema changes.",
        "location": "line 1, column 0",
        "branchIds": []
      }
    ],
    "prunedBranches": [],
    "recommendedForBaseline": true
  },
  {
    "sqlKey": "com.test.mapper.UserMapper.testChooseMultipleIf",
    "risks": [
      {
        "riskType": "select_star",
        "severity": "LOW",
        "message": "Avoid SELECT *. Specify only needed columns to reduce data transfer and prevent issues with schema changes.",
        "location": "line 1, column 0",
        "branchIds": []
      }
    ],
    "prunedBranches": [],
    "recommendedForBaseline": true
  },
  {
    "sqlKey": "com.test.mapper.UserMapper.testIfForeach",
    "risks": [
      {
        "riskType": "select_star",
        "severity": "LOW",
        "message": "Avoid SELECT *. Specify only needed columns to reduce data transfer and prevent issues with schema changes.",
        "location": "line 1, column 0",
        "branchIds": []
      }
    ],
    "prunedBranches": [],
    "recommendedForBaseline": true
  },
  {
    "sqlKey": "com.test.mapper.UserMapper.testWhereChooseWhen",
    "risks": [
      {
        "riskType": "select_star",
        "severity": "LOW",
        "message": "Avoid SELECT *. Specify only needed columns to reduce data transfer and prevent issues with schema changes.",
        "location": "line 1, column 0",
        "branchIds": []
      }
    ],
    "prunedBranches": [],
    "recommendedForBaseline": true
  },
  {
    "sqlKey": "com.test.mapper.UserMapper.testChooseWithMultipleIf",
    "risks": [
      {
        "riskType": "select_star",
        "severity": "LOW",
        "message": "Avoid SELECT *. Specify only needed columns to reduce data transfer and prevent issues with schema changes.",
        "location": "line 1, column 0",
        "branchIds": []
      }
    ],
    "prunedBranches": [],
    "recommendedForBaseline": true
  },
  {
    "sqlKey": "com.test.mapper.UserMapper.testFiveIf",
    "risks": [
      {
        "riskType": "select_star",
        "severity": "LOW",
        "message": "Avoid SELECT *. Specify only needed columns to reduce data transfer and prevent issues with schema changes.",
        "location": "line 1, column 0",
        "branchIds": []
      }
    ],
    "prunedBranches": [],
    "recommendedForBaseline": true
  },
  {
    "sqlKey": "com.test.mapper.UserMapper.testChooseNestedChoose",
    "risks": [
      {
        "riskType": "select_star",
        "severity": "LOW",
        "message": "Avoid SELECT *. Specify only needed columns to reduce data transfer and prevent issues with schema changes.",
        "location": "line 1, column 0",
        "branchIds": []
      }
    ],
    "prunedBranches": [],
    "recommendedForBaseline": true
  },
  {
    "sqlKey": "com.test.mapper.UserMapper.testComplexConditions",
    "risks": [
      {
        "riskType": "select_star",
        "severity": "LOW",
        "message": "Avoid SELECT *. Specify only needed columns to reduce data transfer and prevent issues with schema changes.",
        "location": "line 1, column 0",
        "branchIds": []
      }
    ],
    "prunedBranches": [],
    "recommendedForBaseline": true
  },
  {
    "sqlKey": "com.test.mapper.UserMapper.testDynamicOrderBy",
    "risks": [
      {
        "riskType": "select_star",
        "severity": "LOW",
        "message": "Avoid SELECT *. Specify only needed columns to reduce data transfer and prevent issues with schema changes.",
        "location": "line 1, column 0",
        "branchIds": []
      }
    ],
    "prunedBranches": [],
    "recommendedForBaseline": true
  },
  {
    "sqlKey": "com.test.mapper.UserMapper.testBindIf",
    "risks": [
      {
        "riskType": "select_star",
        "severity": "LOW",
        "message": "Avoid SELECT *. Specify only needed columns to reduce data transfer and prevent issues with schema changes.",
        "location": "line 1, column 0",
        "branchIds": []
      }
    ],
    "prunedBranches": [],
    "recommendedForBaseline": true
  },
  {
    "sqlKey": "com.test.mapper.UserMapper.testTrimPrefixSuffix",
    "risks": [
      {
        "riskType": "select_star",
        "severity": "LOW",
        "message": "Avoid SELECT *. Specify only needed columns to reduce data transfer and prevent issues with schema changes.",
        "location": "line 1, column 0",
        "branchIds": []
      }
    ],
    "prunedBranches": [],
    "recommendedForBaseline": true
  },
  {
    "sqlKey": "com.test.mapper.UserMapper.testChooseTripleNested",
    "risks": [
      {
        "riskType": "select_star",
        "severity": "LOW",